post_id,type,id,parent_id,author,author_flair,created_time,ups,content
1kqbe08,post,1kqbe08,,Greenscreener,,2025-05-19 21:14:25,179,"【标题】Is AI an IT Problem?
【内容】
Had several discussions with management about use of AI and what controls may be needed moving forward.

These generally end up being pushed at IT to solve when IT is the one asking all the questions of the business as to what use cases are we trying to solve.

Should the business own the policy or is it up to IT to solve? Anyone had any luck either way?"
1kqbe08,comment,mt493bn,1kqbe08,BlueNeisseria,,2025-05-19 21:23:08,105,"""IT will become the HR of AI"" - Jensen Huang, CEO Nvidia

but the business MUST define the Policy objectives that IT works within"
1kqbe08,comment,mt4bsx4,mt493bn,[deleted],,2025-05-19 21:39:01,75,[deleted]
1kqbe08,comment,mt4hfqd,mt4bsx4,pmandryk,,2025-05-19 22:09:51,28,"&gt; I can become an incompetent asshole who fails upwards.

This guy's got management written all over him. /s"
1kqbe08,comment,mt4ik2k,mt4bsx4,ISeeDeadPackets,Ineffective CIO,2025-05-19 22:15:43,25,"Is uh....is that not what we're all doing?

![gif](giphy|vUEznRmVQfG2Q)"
1kqbe08,comment,mt63tst,mt4ik2k,Rawme9,,2025-05-20 02:58:07,7,Sometimes I feel that way and then I talk to some of my co-workers
1kqbe08,comment,mt4j59r,mt4bsx4,EldeederSFW,,2025-05-19 22:18:43,14,"The HR motto, “If there aren’t any fires to put out, start one!”"
1kqbe08,comment,mt55eik,mt4bsx4,pdp10,Daemons worry when the wizard is near.,2025-05-20 00:11:02,5,"It's very competitive, failing upwards in the pyramid."
1kqbe08,comment,mt57aou,mt55eik,[deleted],,2025-05-20 00:20:29,4,[deleted]
1kqbe08,comment,mt5rs7r,mt57aou,SparkStormrider,Sysadmin,2025-05-20 01:59:20,3,Keep firing assholes!  There can be only one!
1kqbe08,comment,mt48j59,1kqbe08,NoSellDataPlz,,2025-05-19 21:19:48,128,"I raised concerns to management and HR and let them hash out the company policy. It’s not IT’s job to decide policy like this. You let them know the risks of allowing AI use and let them decide if they’re willing to accept the risk and how far they’re willing to let people use AI.

EDIT: oh, and document your communications so when someone inevitably leaks company secrets to ChatGPT, you can say “I told you so” and CYA."
1kqbe08,comment,mt4c5xb,mt48j59,Greenscreener,,2025-05-19 21:41:03,27,Yeah that is the road I am currently on. They are still playing dumb to a degree and wanting IT to guide the discussion (that we are trying to do) but I seem to be going in circles. Thanks for the reply.
1kqbe08,comment,mt4egs4,mt4c5xb,NoSellDataPlz,,2025-05-19 21:53:46,24,"Welcome.

Were I in your shoes and I was being put on the spot to make a decision, I’d put my wishlist together… and my wishlist would be 1 line:

Full corporate ban on the use of LLMs, SLMs, generative AI, general AI, and all other AI models currently and yet to be created with punitive actions to include immediate dismissal of employment.

And the only way this policy is reversed is once the general public understands the ramifications of AI use and data security. This will hopefully result in management and HR rolling their eyes and deciding it’s just best to consult IT with technical questions and leaving policy making with them."
1kqbe08,comment,mt5o1ns,mt4c5xb,iliekplastic,,2025-05-20 01:41:39,3,They are trying to make you do work that you aren't paid to do because they are too lazy to do it themselves.
1kqbe08,comment,mt72at0,mt4c5xb,FarToe1,,2025-05-20 05:52:22,3,"Remember that it's okay to say no. 

Your job is to inform the decision makers about the risks, and any mitigations you can form against them. 

If the risks are still present (and some will be) then you make them clear and loud and unambiguous."
1kqbe08,comment,mt4e1ii,mt48j59,RestInProcess,,2025-05-19 21:51:26,12,"IT usually has a security team (maybe it's separate), but it's them that hash out the risks. In our case we have agreements with Microsoft to use their Office oriented Copilot, and for some we have the Github Copilot and all other AI is blocked. 

Business should identify the use case, security (IT) needs to deal with the potential leak of company secrets as they do with all software. That means investigation and helping managers at the upper levels understand, so proper safeguards can be put in place."
1kqbe08,comment,mt4hmb5,mt4e1ii,NoSellDataPlz,,2025-05-19 22:10:49,7,"I’d agree this is the case in larger organizations. In my case, and likely OP and many others, security is another hat sysadmins wear. In my case, I don’t have a security team - it’s just lil ol’ me."
1kqbe08,comment,mt4kvuj,mt4hmb5,MarshallHoldstock,,2025-05-19 22:27:45,4,"I'm the lone IT guy, but we have a security team of two. One of them is third-party. They meet once a month to go over all ISMS stuff and do nothing else. All policies, all risk-assesment, etc. that would normally be done by security I have to do, because it's less than an afterthought for the rest of the business."
1kqbe08,comment,mt4rc4d,mt4hmb5,Maximum_Bandicoot_94,,2025-05-19 23:00:45,2,Putting the people charged with and goaled upon uptime in charge of security is a conflict of interest.
1kqbe08,comment,mt57b4p,mt4rc4d,NoSellDataPlz,,2025-05-20 00:20:32,1,"You’d be shocked what a small budget does to drive work responsibilities. I’ve been putting together a proposal to expand IT by another sysadmin, a cyber and information security admin, an IT administrative assistant, and an IoT admin for systems that aren’t servers or workstations. My hope is that it slides the Overton Window enough that they’ll hire a security admin and forego the other items and will be thrilled if they hire an additional any of the other staff."
1kqbe08,comment,mt5stz0,mt57b4p,Maximum_Bandicoot_94,,2025-05-20 02:04:22,1,"My last shop worked like that.  I fixed the problem by dumping their toxic org.  They floundered for 2+ years to completely replace me, by the time my last contacts at the former org left they had to replaced me with 5 people which combined, including benefits etc, probably cost that org 3x what I did.  ""At will""' cuts both ways in the states.  Companies would due well to be reminded of that more often."
1kqbe08,comment,mt5yddv,mt5stz0,NoSellDataPlz,,2025-05-20 02:31:24,1,"My employer isn’t toxic or anything like that. It’s a state job with a very well spent budget. If my proposal gets accepted, even if in part, it’s up to the bean counters to find the money. It’s not my problem. My problem is exposing the risks to the organization should they fail to act. If they opt to not act, I’m free and clear and I still get my paycheck should shit hit the fan."
1kqbe08,comment,mt5sc36,mt4e1ii,RabidBlackSquirrel,IT Manager,2025-05-20 02:01:57,2,"Security itself would rarely be the one to hash out the policy. It's not infosec's job to accept risk on behalf of the company. We would however, detail the risks and propose controls and detail negative outcomes so Legal/whoever can make an informed risk decision, and then maintain controls going forward. 

If I got to accept risks, I'd have a WAY more conservative approach. Which speaks to the need to not have infosec/IT be the one making the decision - it's supposed to be a balance and align with the business objectives."
1kqbe08,comment,mt48o1a,1kqbe08,admlshake,,2025-05-19 21:20:37,43,Yes and no.  We can block it or allow it.  But it's up to the company decision makers to decide the use cases.
1kqbe08,comment,mt5aq1j,mt48o1a,NobodyJustBrad,,2025-05-20 00:37:30,13,I feel like it's also up to Legal/HR to own the use policy.
1kqbe08,comment,mt64naw,mt5aq1j,skob17,,2025-05-20 03:02:11,1,Data Protection Office at our place
1kqbe08,comment,mt5hpmk,mt48o1a,ehxy,,2025-05-20 01:11:27,2,"They are the ones that make use of it.  We facilitate it and set it up but it's not what we rely on to do our job.  Yes, AI can help us but we've been doing this since before AI has been a thing.  AI can't troubleshoot physical world space and perform the fix.  It knows as much as the person tells it and a user can ask it whatever vague non informative answer it wants and it will spit out a dozen scenarios until it gets to the answer and a user that can stand long enough to read it wouldn't be hitting us up on anything anyway if they had that kind of patience let alone do a Google search themselves."
1kqbe08,comment,mthkcv7,mt48o1a,bh0,,2025-05-21 23:22:49,1,"This is basically it. I've been asked what options we have to block certain AI sites/tools, but as far as policy decisions about using them, that's not on us to decide."
1kqbe08,comment,mt48psy,1kqbe08,[deleted],,2025-05-19 21:20:54,39,It's an everyone problem.
1kqbe08,comment,mt5ewh0,mt48psy,7FootElvis,,2025-05-20 00:57:54,6,Opportunity
1kqbe08,comment,mt5ie1k,mt5ewh0,[deleted],,2025-05-20 01:14:43,12,My eye is twitching in your general direction.
1kqbe08,comment,mt5jcao,mt5ie1k,7FootElvis,,2025-05-20 01:19:18,5,"Lol! I'm half serious, half mocking the corporatese."
1kqbe08,comment,mt5jphu,mt5jcao,[deleted],,2025-05-20 01:21:02,4,"Aye, only one eye is twitching in some other direction then."
1kqbe08,comment,mt66nho,mt5jcao,Baerentoeter,,2025-05-20 03:12:18,2,But for real though... never waste a good crisis.
1kqbe08,comment,mt6gyi7,mt66nho,7FootElvis,,2025-05-20 04:04:05,1,"Yes, and it's a great opportunity for IT people to lead the way to help use the proper tools, in the proper way, to achieve better business outcomes, or to achieve existing outcomes more efficiently or effectively."
1kqbe08,comment,mt5glk0,mt48psy,ehxy,,2025-05-20 01:06:05,1,Yeah but who wants to own it 😄
1kqbe08,comment,mt4gzf2,1kqbe08,Dreilala,,2025-05-19 22:07:27,28,"We have a very expensive project regarding copilot with extremely positive people spouting the virtues of using AI in the work place.

I once dared ask what actual (monetary) benefit has arisen for the company as a result of said AI I was deemed too negative. 

I have since changed my attitude.

Go Copilot!!!"
1kqbe08,comment,mt6ltxv,mt4gzf2,TheMagecite,,2025-05-20 04:28:18,9,"Our company drank the Gen AI kool aid and went mad trying to get AI wins.  I have noticed virtually all of our AI wins lately have strangely been lumped in with automation wins with just traditional automations using Power Automate considered ""AI"".

I have been telling everyone for ages we will get far more bang for buck automating than Gen AI could ever deliver.

  
Go AI ..... I guess."
1kqbe08,comment,mt9rgga,mt4gzf2,JazzlikeSurround6612,,2025-05-20 18:08:33,2,"Sadly that's how it is. All the smooth brain MBA C-level types creaming themselves over AI but they don't care to hear if you don't have the proper data sets, environment, resources etc to implement it, or actual use cases that may have a payback."
1kqbe08,comment,mt48goa,1kqbe08,[deleted],,2025-05-19 21:19:24,137,"The business 

If it’s up to IT just blanket ban it until further notice"
1kqbe08,comment,mt48v43,mt48goa,thecstep,,2025-05-19 21:21:47,15,Everything has AI. So what now?
1kqbe08,comment,mt4cajd,mt48v43,TechCF,,2025-05-19 21:41:46,15,"Yes, it is like the API craze from 20 years ago. Is API an IT issue?"
1kqbe08,comment,mt4gwp8,mt4cajd,TheThoccnessMonster,,2025-05-19 22:07:02,16,…. Depends on whose but yes.
1kqbe08,comment,mt4vlyi,mt4gwp8,Thoughtulism,,2025-05-19 23:22:13,9,"Unless there's HR consequences and procurement controls you can accept responsibility all you want if nothing happens when rules are broken then they're not rules

That being said putting the rules in and measuring the lack of compliance is a good first step to getting clueless leaders to make better decisions and understand they have zero control over anything unless they put in specific levers to exercise control."
1kqbe08,comment,mt7iccv,mt4vlyi,ImFromBosstown,,2025-05-20 07:24:45,1,Correct
1kqbe08,comment,mta4x1k,mt4cajd,daishi55,,2025-05-20 19:57:08,1,"&gt; API craze

Are you referring to computers interacting with each other? I didn’t realize that constituted a craze"
1kqbe08,comment,mt6ojgg,mt48v43,hkusp45css,IT Manager,2025-05-20 04:41:36,3,"Yeah, I'll just blanket ban the Edge browser. 

There, no more AI. 

How do you like THAT?"
1kqbe08,comment,mt807io,mt48v43,RobertBiddle,,2025-05-20 09:12:43,1,Malicious compliance level 9000!!! 😈
1kqbe08,comment,mt4952m,mt48goa,SocialDoki,,2025-05-19 21:23:25,5,This is my approach. I can be there to advise on how different AIs work if the org wants to build a policy but I don't know what ways people are going to use it and I'm not taking that risk if it ends up on my shoulders.
1kqbe08,comment,mt48o49,mt48goa,nohairday,,2025-05-19 21:20:38,15,"Personally, I prefer ""Kill it with fire"" rather than a blanket ban."
1kqbe08,comment,mt4aa3w,mt48o49,Proof-Variation7005,,2025-05-19 21:30:09,33,"Half of what AI does is just google things and then take the most upvoted Reddit answers and present them as fact so I've found the best way to prevent it from being used is to put on a frog costume and throw your laptop into the ocean.  

If you don't have access to an ocean, an inground pool will work as a substitute.  Above-ground pools (why?) and lakes/rivers/puddles/streams/ponds won't cut it."
1kqbe08,comment,mt4c1s1,mt4aa3w,poorest_ferengi,,2025-05-19 21:40:25,2,What about a dragon costume and thermite?
1kqbe08,comment,mt4nvmk,mt4c1s1,Proof-Variation7005,,2025-05-19 22:43:14,1,that only makes AI stronger
1kqbe08,comment,mt4gyjy,mt4aa3w,jsand2,,2025-05-19 22:07:19,-2,"You do realize that there are much more complex AI out there than the free versions you speak of on the internet, right??

We pay a lot of money for the AI we use at my office and it is worth every penny. That stuff seems to find a new way to impress me everyday."
1kqbe08,comment,mt4ij8k,mt4gyjy,nohairday,,2025-05-19 22:15:36,11,"Can you give some examples?

Genuinely curious as to what benefits you're seeing. My impression of the GenAI options is that they're highly impressive in terms of natural language processing and generating fluff text. But I wouldn't trust their responses for anything technical without an expert reviewing to ensure the response both does what is requested and doesn't create the potential for security issues or the like.


The good old ""just disable the firewall"" kind of technical advice."
1kqbe08,comment,mt6l2r4,mt4ij8k,perfecthashbrowns,Linux Admin,2025-05-20 04:24:36,3,"I recently had to swap from pgCat to pgpool-II because I ended up hating pgCat so I told Claude to convert the pgcat.toml config to an equivalent pgpool-ii config and it did just great. I also use it for things like double-checking GitHub Actions before I commit them so I don't miss anything dumb. Or I'll have it search the source code for something to find an option that isn't documented, which I had to do a bit with pgCat. Lots of times I'm also using it to learn, asking it to test me on something and I will check my understanding that way. Claude once got an RBAC implementation in Kubernetes correct while Deepseek R1 got it wrong, though! And sometimes I'll run architectural questions to a couple different LLMs to see if they give me any ideas or they correct me on something. I also recently asked Claude if an idea I had with Facebook's Faiss would work and it pumped out 370 lines of Python code to test and execute my idea which worked. But that is code that's not going to be used. I'm just going to use it as a guideline and re-write all of it since I need to actually double-check everything. I didn't even ask it to write anything! Just asked it if my idea would work. It can get annoying when I just ask a quick question and it pumps out pages of code, lol."
1kqbe08,comment,mt4rvqn,mt4ij8k,jsand2,,2025-05-19 23:03:29,1,"We have 2 different AIs that we use. 

The first sniffs our network for irregularities. It constantly sniffs all workstations/servers logging behavior. When a non common behavior occurs it documents it and depending on the severity shits the network down on that workstation/server. So examples of why it would shut the network down on that device could range from and end users stealing data onto a thumb drive to a ransomware attack. 

We have a 2nd AI that sniffs our emails. It also learns patterns of who we receive email from. It is able to check hyperlinks for mailciousness and lick the hyperlink if needex, check files and convert the document as needed, identify malicious emails, and so much more.

While a human can do these tasks, it would take 10+ humans to provide the same amount of time invested to do all of these things. I was never offered 10 extra people, it was me and 1 other person handling these 2 roles. Now we have AI assisting for half the cost of 1 other human, but providing us the power of 10 humans.

They do require user interaction for tweaking and dialing it in. But it runs pretty damn smooth on its own."
1kqbe08,comment,mt4upft,mt4rvqn,nohairday,,2025-05-19 23:17:41,8,"So both ML's then. Rather than LLM's.

That's what I was suspecting, but wanted to confirm.

Genuinely curious what the AI is to your examples as opposed to more standard email AV/intrusion detection solutions, as they can also check for dodgy hyperlinks and the like. And the same for the network. Sounds very similar to what SCOM could be set up to do.

Admittedly, I haven't been near SCOM or any replacements for quite a few years.

But giving employees access to Copilot, chatGPT, and the like? That's where all of the security implications *really* come into play."
1kqbe08,comment,mt51oo8,mt4upft,Frothyleet,,2025-05-19 23:52:35,9,"&gt;So both ML's then. Rather than LLM's.

5 years ago, the technology was just ""algorithms"". Then LLMs made ""AI"" popular, and now any software that includes ""if-then"" statements is now AI."
1kqbe08,comment,mta5fob,mt4upft,daishi55,,2025-05-20 20:00:43,1,LLMs are ML
1kqbe08,comment,mt4vep6,mt4upft,jsand2,,2025-05-19 23:21:12,1,"Yea we weren't comfortable opening up AI to the employees. While we feel we have things locked down properly, but we didnt want to take chances unleashing AI through our network folders and giving all employees access to that kind of power."
1kqbe08,comment,mt81aug,mt4rvqn,giantrobothead,,2025-05-20 09:19:34,1,"“…depending on the severity shits the network down…”

Please don’t correct this typo."
1kqbe08,comment,mt5576e,mt4rvqn,sprtpilot2,,2025-05-20 00:10:01,1,Not really AI.
1kqbe08,comment,mta5g7x,mt5576e,daishi55,,2025-05-20 20:00:49,1,How so?
1kqbe08,comment,mt63lm7,mt4ij8k,Rawme9,,2025-05-20 02:57:01,1,"I have had the exact same experience. It is good if *you* know what it's talking about and can save some time with some tasks. If not, it is outright dangerous and untrustworthy."
1kqbe08,comment,mt4np8n,mt4gyjy,Proof-Variation7005,,2025-05-19 22:42:20,2,why don't you ask AI what a joke is then
1kqbe08,comment,mt48xrw,mt48o49,RoomyRoots,,2025-05-19 21:22:14,12,And that is how shadow IT starts.
1kqbe08,comment,mt493fi,mt48xrw,H3rbert_K0rnfeld,,2025-05-19 21:23:09,5,Seconded
1kqbe08,comment,mt49ct5,mt48xrw,nohairday,,2025-05-19 21:24:41,5,"Fire cleanses all, including Shadow IT and the perpetrators of it.

Seriously, there are so many potential issues with the current 'AI' craze that I wouldn't let it near any data at present.

It's not my decision, but it is my opinion."
1kqbe08,comment,mt4h07c,mt48xrw,TheThoccnessMonster,,2025-05-19 22:07:34,2,We call that DevOps these days.
1kqbe08,comment,mt82we5,mt48goa,azurite--,Sr. Sysadmin,2025-05-20 09:29:35,1,"This is how you get your employees to hate your department. You don't do a blanket ban without an explanation, and even so there is copilot which protects company data on an enterprise level so if you are a Microsoft shop there is less of a reasoning to not explore it at least.

I'm part of an AI initiative in my company and clearly see how people are utilizing AI tools and how it is helping them day to day. Turns out people like tools that help them."
1kqbe08,comment,mt4cmak,1kqbe08,jbourne71,"a little Column A, a little Column B",2025-05-19 21:43:36,45,"Legal, HR, management/leadership set policy. Cybersec/infosec develops security controls to implement policy. IT executes within scope. 

Or something like that."
1kqbe08,comment,mt6rpli,mt4cmak,wanderinggoat,,2025-05-20 04:57:05,6,"reminds me of working for an MSP at a larger company and i noticed a machine had become infected and had spread to a share on the NAS, I went straight over to the security team, advised them and asked what the process was and who would manage it.
blank stairs and somebody said ""maybe the helpdesk.."""
1kqbe08,comment,mt9ogih,mt4cmak,X0mbiRapt0r,,2025-05-20 17:38:50,1,This. 👆🏻
1kqbe08,comment,mt4bny9,1kqbe08,thegeekgolfer,,2025-05-19 21:38:15,22,"Not everything that involves a computer is IT. It's easy for businesses to say it's IT, because many are ran by idiots. But, everything coming into a company these days involves a computer in one way or another."
1kqbe08,comment,mt5av69,mt4bny9,TechIncarnate4,,2025-05-20 00:38:12,21,"&gt;Not everything that involves a computer is IT

You're right.  Its everything that has a power cable.  :-)"
1kqbe08,comment,mt6fwep,mt5av69,xdamm777,,2025-05-20 03:58:44,7,What about a director opening a ticket because he can’t get Apple Car Play to work on his new BMW? Still IT according to the guy.
1kqbe08,comment,mt7vz5j,mt6fwep,12inch3installments,,2025-05-20 08:46:37,6,"Our CEO did this.  Bought a brand new M8 convertible, couldn't pair his phone, came to IT for us to pair it for him."
1kqbe08,comment,mt8d3fh,mt7vz5j,rcp9ty,,2025-05-20 10:33:49,4,"I had a coworker ask me to help setup an app for his new company truck so he could do remote start 🙄
My boss said do that when you get bored and everything else is taken care of don't even bother giving it a priority or zero."
1kqbe08,comment,mt608om,mt5av69,GloveLove21,,2025-05-20 02:40:39,4,"Ah yes, ""the water fountain isn't working!""

A ticket I once received."
1kqbe08,comment,mt8x8xr,mt608om,No_Refrigerator2969,,2025-05-20 13:05:51,2,😂🥲🥲
1kqbe08,comment,mt48sod,1kqbe08,imgettingnerdchills,,2025-05-19 21:21:23,8,All of these discussions/decisions need to happen at the management level and also very likely need to involve your legal team. Once they decide on the policy then you can do what part you have in enforcing it. 
1kqbe08,comment,mt49hip,1kqbe08,redditphantom,,2025-05-19 21:25:28,10,I feel it's a shared responsibility.   IT needs to think about security from data exposure and access. Management needs to think about appropriate usage from the business perspective.  Management should also understand the risks to business that they may not be aware of if they aren't versed in IT language.  It is not a black and white discussion and both sides have to discuss and solution the policy to what makes sense for the business.  Every business is going to be different but without understanding the risks and benefits from all sides will this be solved
1kqbe08,comment,mt7dz4p,mt49hip,ButtThunder,,2025-05-20 06:59:27,3,Absolutely shared. I wrote the policy with input from HR and legal.
1kqbe08,comment,mt499xp,1kqbe08,Wheredidthatgo84,,2025-05-19 21:24:13,32,"Management 100%. Once they have decided what they want, you can the implement it."
1kqbe08,comment,mt5avgd,mt499xp,Defconx19,,2025-05-20 00:38:15,13,"Eeehhhh, sort of.


I'm say it's joint. The problem is management can quickly decide on a scope of AI implementation that isnt realistic.


IT should be at the table to advise what the implications are and what resources are likely needed.  Then ELT can decide from there and IT can deploy.


Edit: essentially its a DLP issue so I'd say it's more IT if anything."
1kqbe08,comment,mt6032f,mt5avgd,GloveLove21,,2025-05-20 02:39:53,1,100% a risk management/IT/leadership joint issue in my opinion and org.
1kqbe08,comment,mt6oa9p,mt5avgd,hkusp45css,IT Manager,2025-05-20 04:40:22,1,"DLP is a compliance problem, in my sector. Thank goodness."
1kqbe08,comment,mt5h1dd,mt499xp,blissed_off,,2025-05-20 01:08:13,1,Never let management make technology decisions without involving IT.
1kqbe08,comment,mt4bch6,1kqbe08,slashinhobo1,,2025-05-19 21:36:26,8,"I raised concerns, but they didn't act on it. It's no longer my problem."
1kqbe08,comment,mt4ew2w,1kqbe08,toebob,,2025-05-19 21:56:05,8,It is up to IT to explain the risks in clear language that the business can understand. And not just general risks - evaluate each use case. Using AI to create pictures for the intranet department webpage is a much different risk than putting an AI bot on the public homepage.
1kqbe08,comment,mt4fpyy,mt4ew2w,Greenscreener,,2025-05-19 22:00:35,3,"Yeah that is part of the issue tho. The number of tools and different ways ‘AI’ can be used is changing on a daily basis. 

Big chunk of the challenge is keeping up so advice can be given. It is a major workload addition that is not being recognised."
1kqbe08,comment,mt4mebe,mt4fpyy,toebob,,2025-05-19 22:35:39,1,"“More work than workers” is not a new problem. We should deal with that the same way we did before AI. Don’t be a hero and work a bunch of unpaid overtime to cover up a staffing problem. 

The way we do it at my place: all new software with AI components has to be evaluated by IT. If IT doesn’t have the staff or time to get to the eval right away then the business doesn’t get that AI component until IT can properly evaluate it and provide a risk assessment. If the business goes around IT and takes the risk anyway - that’s not IT’s fault.

Edit: replaced “evil” with “eval” - though it could have worked either way."
