post_id,type,id,parent_id,author,author_flair,created_time,ups,content
1kqbe08,comment,mt490qe,1kqbe08,user3872465,,2025-05-19 21:22:43,3,"Policy = HA, or other Descision makers

Realization, Kowhow, Technical Background info = IT

  
I am not making policies nor do I descide on where,what,how,who can use AI and whatnot. I can give info and context to help others in Policy or Descision making. I'll gladly talk to managment and educate them as far as I know. But I am not making a Descision for them, I don't get payed enough to do that."
1kqbe08,comment,mt4dkdt,mt490qe,SoonerMedic72,Security Admin,2025-05-19 21:48:50,1,"The only way you should be writing policies is if you are in IT/InfoSec management. Like, I had to write policies before, but I also present any changes to the board every quarter. I wouldn't have asked someone else to do it. 🤷‍♂️"
1kqbe08,comment,mt4po7g,1kqbe08,JohnBeamon,,2025-05-19 22:52:24,3,"Asking me to use AI without telling me what you want done is like telling me to use Excel without giving me tasks or data. If management has a task that's well-suited for AI, I'll use AI to solve it. Otherwise, they're paying me FT salary to make six-fingered memes all day."
1kqbe08,comment,mt4qnu8,1kqbe08,Ivy1974,,2025-05-19 22:57:24,3,AI basically an interactive Google. It is as good as the person that programmed it. Till it can weed out the nonsense fixes on its own we are still needed.
1kqbe08,comment,mt6l8e0,1kqbe08,Kibertuz,,2025-05-20 04:25:22,3,"AI is a marketing problem, they dont know shytttt about AI but want to include AI world in every conversation."
1kqbe08,comment,mt8xfyo,mt6l8e0,No_Refrigerator2969,,2025-05-20 13:07:35,2,care to have some AI screen protectors 😂😂
1kqbe08,comment,mtalb31,mt8xfyo,Kibertuz,,2025-05-20 21:39:27,1,HaHa as long as it does cybersecurity i will buy 2
1kqbe08,comment,mtz2lfr,mtalb31,No_Refrigerator2969,,2025-05-24 15:34:43,1,that would be 100dollars/month standard
1kqbe08,comment,mt91fbc,1kqbe08,Killbot6,Jack of All Trades,2025-05-20 13:42:53,3,"We blocked all AI websites on our network, except for enterprise Copilot. As Copilot has at least said they will safe guard the info and data that is input into it, and not use it. 

Do I really trust it? Not really, but our C-Suite team has decided they need it and disregard anything else said on the topic."
1kqbe08,comment,mt9ir8q,1kqbe08,stitchflowj,,2025-05-20 16:38:02,3,"I respect the point of view that most people are making on this thread that it's a business policy problem first - they set the objectives and IT can implement. It's an understandable sentiment but I don't think it's realistic. 

Every CEO is on Twitter reading folks like Aaron Levie (Box CEO) and Tobi Lutke (Shopify CEO) talk about AI enabled productivity and how AI adoption is a strategic imperative. That means AI tools are going to mushroom super fast in your orgs and IT/compliance/security can't be seen as the productivity killing police.

But of course, these shiny new apps are shipping with zero enterprise-grade controls - no SAML, no SCIM, often not even usable user admin controls. So every tool and account turns into a one-off headache. 

Bottom line IMHO: IT/Security/Compliance can't wait for the business to define the policy here. The teams responsible for keeping the lights on are going to be stuck between enabling productivity and cleaning up an ever-growing security, compliance, and cost mess, and so you need to get ahead of it."
1kqbe08,comment,mt49a9a,1kqbe08,lord_of_networks,,2025-05-19 21:24:16,15,"As usual this sub is full of angry greybeards. The business is asking you because they think IT is the group with the best chance of guiding the org. Now, you need to be upfront with the organisation about needing the budget to do it, you also need to demand help where needed like legal issues. But take the opportunity to shine and be seen as more than a digital janitor"
1kqbe08,comment,mt4ece0,mt49a9a,[deleted],,2025-05-19 21:53:06,3,"Because we all love taking on more work and responsibility for the same pay. 

You either just graduated and haven't learned that you're nothing more than a disposable tampon to your employer, or you are that employer looking for fresh tampons."
1kqbe08,comment,mt5etgr,mt4ece0,ABotelho23,DevOps,2025-05-20 00:57:30,2,AI is not a fridge or a toaster.
1kqbe08,comment,mt4jtuc,mt4ece0,bigwetdog10k,,2025-05-19 22:22:14,2,Some people *like* integrating new tech into our organizations. Any crude analogies for that?
1kqbe08,comment,mt59h0m,mt4jtuc,nlfn,,2025-05-20 00:31:18,0,"How about ""oh, you're just giving the users a strap-on only to have them turn around and use it on you""?

(I'm team ""ITS should be familiar with AI and help decision-makers"" but it's hard to resist the call of a crude analogy)"
1kqbe08,comment,mt4el78,1kqbe08,qwikh1t,,2025-05-19 21:54:27,2,IMO; companies should host their own AI. That way is controllable by IT. Put out policy concerning AI usage is only allowed through the company.
1kqbe08,comment,mt4i2g2,1kqbe08,pmandryk,,2025-05-19 22:13:10,2,Ok. This is great but what about A1? Who gets to use A1 and on what!?!
1kqbe08,comment,mt4lmqt,1kqbe08,mrtobiastaylor,,2025-05-19 22:31:40,2,"Depend on how many business functions sit with IT.

In my firm - my team look after Data and Compliance (so DPO and associated functions)

Policy first for using AI, any tooling that uses it needs to approved where reasonable i.e Google Search wouldn't be within scope, but Chat GPT would be. Staff cannot setup accounts on systems on behalf of the business, nor share anything relating to the company including PII, IP or internal communications/materials. And we obviously, very strict on this.

Second to that, all systems we use must be protectable by SSO/IDP. This somewhat limits what systems we can use which is useful.

All applications must go on a risk register, and be accountable and auditable. We save all privacy policies and only approve applications where our data can be validated end to end (so we get data flow diagrams e.t.c) along with ensuring that our data does not get shared into any collective LLM. 

Ive always taken the approach that if policy doesn't exist, I'm writing it and sharing it with the firm. If someone kicks up, ask them why they didn't do it if it was their responsibility."
1kqbe08,comment,mt56gh2,1kqbe08,alexandreracine,Sr. Sysadmin,2025-05-20 00:16:17,2,"The business should create the policy, then you tell them how much it will cost, then they will change the policy :P"
1kqbe08,comment,mt6856w,1kqbe08,GhostDan,Architect,2025-05-20 03:19:48,2,"I've been asked to troubleshoot coffee machines..

Everything is IT"
1kqbe08,comment,mt76ils,1kqbe08,accidentalciso,,2025-05-20 06:16:01,2,"It involves computers, so yes, it’s going to get dumped on IT, but in reality, it’s every part of the company’s problem. Like security, if it gets concentrated in a single team/function, you are going to have a terribly difficult time."
1kqbe08,comment,mt48g92,1kqbe08,kg7qin,,2025-05-19 21:19:20,3,Yes.
1kqbe08,comment,mt4c6wt,1kqbe08,JimmySide1013,,2025-05-19 21:41:12,2,AI is content and IT shouldn’t be doing content. There’s certainly a permission/logging component which IT would be responsible for but that’s it. We’re not responsible for what users type into their email any more than what they type into ChatGPT.
1kqbe08,comment,mt49nka,1kqbe08,jupit3rle0,,2025-05-19 21:26:27,1,"It should be 100% up to the business to own the policy. At the very least, they need to have a FULL understanding of what they are asking AI to accomplish, and what it could potentially cover (and replace?). At the end of the day, someone needs to remind these people that AI could very likely end up being their #1 competition in the job market, and I'd imagine that is supposed to result in collective hesitancy, not wonder."
1kqbe08,comment,mt4b0mm,mt49nka,limlwl,,2025-05-19 21:34:33,1,"Why should it be 100% up to the business to own the policy? Is IT not part of the business?? If you do separation now, then IT will never be the leader; especially when ""the business"" is looking to IT for leadership in the field of AI."
1kqbe08,comment,mt4ajmp,1kqbe08,vlad_h,,2025-05-19 21:31:45,1,You’d have to elaborate with more details on what controls and what the issue is that you are trying to solve. In my experience LLMs (it’s not AI people!) are a tool and are very useful but far from perfect.
1kqbe08,comment,mt4c2k3,1kqbe08,psu1989,,2025-05-19 21:40:32,1,AI is a company (tech risk mgt team) concern and any technical controls they request would then be a request to Security\\IT. Any other concerns would be a Company/HR concern.
1kqbe08,comment,mt4c2ya,1kqbe08,Zolty,Cloud Infrastructure / Devops Plumber,2025-05-19 21:40:36,1,"A company I know of has a policy explicitly banning AI chat bots meanwhile half the departments are shockingly seeing 40-50% increases in productivity on projects. If you ban something this useful you're going to have a revolt.

Get your company a paid for AI provider that will obey your data privacy requirements."
1kqbe08,comment,mt4c4ko,1kqbe08,TechCF,,2025-05-19 21:40:51,1,"I prefer it IT is asked about tooling, but tools used at a company. Hardware,software or human resources is not an IT issue. Replace AI with words like ""hammer"" or ""powerpoint"" and ask again."
1kqbe08,comment,mt4cxj1,1kqbe08,Ok-Big2560,,2025-05-19 21:45:19,1,"It's a corporate compliance issue.

I block everything unless a senior leader/decision maker/scapegoat provides documented approval."
1kqbe08,comment,mt4dm50,1kqbe08,kremlingrasso,,2025-05-19 21:49:06,1,AI is primarily an access problem from an IT point of view. Both who has access to it and what data those people have access to. So whoever controls those best define the AI policy. In most case that's IT unless you have a dedicated compliance/data governance org.
1kqbe08,comment,mt4dyna,1kqbe08,yawn1337,Jack of All Trades,2025-05-19 21:51:00,1,"IT looks at data protection and cybersecurity laws, then outlines what is allowed and not allowed. Management signs off on the use policies. IT restricts what can be restricted"
1kqbe08,comment,mt4f9n5,1kqbe08,dankmemelawrd,,2025-05-19 21:58:08,1,Absolutely not.
1kqbe08,comment,mt4gdcl,1kqbe08,jsand2,,2025-05-19 22:04:07,1,"It depends on the AI you speak of. 

If you were to allow your end users to use AI, you would need to double and triple check k your security on your network folders. For instance, if Harold had access to a folder of Kumar's that Kumar saved his paycheck stubs in, then Harold would be able to see Kumar's pay information via AI. In this instance, yes AI is 100% an IT problem to deal with.

We dont feel comfortable offering AI to our end users. So we have opted to not to offer it to our end users.

We do however use AI in our IT Department. We have an AI that sniffs our network for irregularities and reports them to us. If it feels we have a breach it will shut the network down on that workstation until we can react. We have another that sniffs email for irregularities. It will action accordingly as needed whether it be holding an email, locking a link, or converting an attachment. To be honest, it would be hard working for a company that didnt have AI in place for things like this. It is so much more efficient than humans, but still requires someone like me to manipulate it."
1kqbe08,comment,mt7izei,mt4gdcl,ImFromBosstown,,2025-05-20 07:28:25,1,What services are you using for this specifically?
1kqbe08,comment,mt7jxxw,mt7izei,jsand2,,2025-05-20 07:33:58,1,The company is called Darktrace. They offer both solutions.
1kqbe08,comment,mtkcnn0,mt4gdcl,No-Boysenberry7835,,2025-05-22 07:35:01,1,This ai run on your own server ?
1kqbe08,comment,mtke5du,mtkcnn0,jsand2,,2025-05-22 07:43:30,1,"We have an in house appliance (basically their server), yes, but most of it happens in the cloud."
1kqbe08,comment,mtmx71a,mtke5du,No-Boysenberry7835,,2025-05-22 19:21:16,1,So a full external black box identitie can shutdown your network and have full acces over almost everything ? Dont seem like a good practice
1kqbe08,comment,mtn657o,mtmx71a,jsand2,,2025-05-22 20:22:33,1,"We survived a ransomware attack around 10 years ago. It took our 3 man team 72 hours pretty much straight to rebuild and recover our data. We had to shut our business down those 3 days. I had a 13 hour phone call with our AV company during that time!

That will never happen again. This AI will drop the network of whatever device is corrupted to keep it from spreading. During business hours, we have to take action on 75% of the issues. But after business hours we have something watching for irregularities and stopping anything needed. 

Being afraid of AI, you might think it is a bad idea, but it has been nothing but a benefit to our company. This new email AI I have fallen in love with. We had our shit so locked down it wasn't even funny. We were able to remove the majority of blocks and let the AI do the job. 

Before, any office (word, excel, etc) files were blocked by default. Now, AI scans the file and if it feels it is malicious in any way it converts the attachment to something not malicious. For instance an xlsx file in question would convert to csv. They could still get their data, but it removes the macros, etc same with pdfs. It does the same with links. Vets the link and if it is deemed malicious, it locks the link so they can't click it. This allows content to get to employees and if it was actually legit they can request the original. 

Thats cool if you want to be scared of the future, but I am going to embrace it. I see the good in it and it outweighs the bad. Especially when my job is AI manipulation. I am in control."
1kqbe08,comment,mt4h0bs,1kqbe08,TuxAndrew,,2025-05-19 22:07:35,1,Unless we have a BAA with them we generally can’t use it for critical data unless we’re hosting the system.
1kqbe08,comment,mt4iwn0,1kqbe08,BlueHatBrit,,2025-05-19 22:17:31,1,"AI is not a discrete area - it cuts across multiple spaces and will need broad collaboration from areas of the business to ensure it's usage is properly thought about.

IT and technology departments will of course have to play a big role. They'll probably be responsible for a lot of integration work, as well as the technical implementation of policies (blocks or whatever). But the company as a whole needs to figure out what makes sense for each area and where to draw lines.

You probably need a small group with IT, InfoSec, HR, and representation from the revenue generting sections of the business. They can figure out what the starting point is. That's probably blessing a chosen vendor and putting together a policy which says things like ""don't upload healthcare patient data into the chatgpt UI"" or whatever is needed. Then the business as a whole goes from there, each doing their roles.

HR make sure policies are communicated, understood, and enforced. IT and InfoSec do whatever is needed to make the blessed tools accessible and limit access to the others, etc etc...

The businesses that treat this as just one person or departments job to ""do AI"" are the ones who won't find any benefit from it at all. Someone will use it to pad their resume for a year or two, maybe spend a bunch of money badly, and then move on to some strange ""AI Adoption Development"" role in another company."
1kqbe08,comment,mt4jdw9,1kqbe08,[deleted],,2025-05-19 22:19:58,1,[removed]
1kqbe08,comment,mt4l9tz,1kqbe08,Fast-Mathematician-1,,2025-05-19 22:29:47,1,"It's up to the business to identify the want an IT to box it up and deliver it. Business drives the need, and IT CONTROLS  the implementation within the scope of the business requirements."
1kqbe08,comment,mt4mvcb,1kqbe08,axle2005,Ex-SysAdmin,2025-05-19 22:38:07,1,"It's 100% IT's job when upper manglement pushes out an ""AI-based"" application that immediately crashes half the working systems and no one else is smart enough to fix what it broke... unfortunately..."
1kqbe08,comment,mt4n2er,1kqbe08,Bright_Arm8782,Cloud Engineer,2025-05-19 22:39:07,1,"I think we should, we are the department that think about implications of what we are doing and raise questions that most of the rest of business find annoying, things like compliance with standards, making sure that data we don't want going out to places doesn't get there and the like.

If we don't then someone else will, because they want to use grammarly or the like and then we become the bad guys for taking their toys away."
1kqbe08,comment,mt4nctq,1kqbe08,Actor117,Sysadmin,2025-05-19 22:40:35,1,"I built a general policy using the framework NIST offers. I already was given an idea bout what AI the company wants to allow and what it doesn’t. I completed a draft of the policy and submitted it to Legal and the CEO to make changes as they see fit. Once that’s done I’ll implement controls, where possible, to enforce the policy and the rest will be handled by an understanding that anything outside of ITs ability to control is a management issue."
1kqbe08,comment,mt4p0mx,1kqbe08,kitkat-ninja78,IT Manager over 20 years XP,2025-05-19 22:49:04,1,"IMO, it's a joint issue.  IT can not do this alone, yet IT has to be the one to protect users from a technical point of view.  Business management/leader has to be the one to set business policy with other departments to back up and implement, eg HR from a people procedure point of view, IT from a technical standpoint, etc....

Having IT solely sorting this out would be like the tail wagging the dog, instead of the dog wagging the tail."
1kqbe08,comment,mt4pju8,1kqbe08,CLE-Mosh,,2025-05-19 22:51:47,1,Walk over to the rack power supply.... Pull the plug... Can AI Do That????  Walk Away
1kqbe08,comment,mt4q1fr,1kqbe08,That_Fixed_It,,2025-05-19 22:54:16,1,"IT should have a better chance of understanding of what products and restrictive policies can be deployed, and how to mitigate specific security implications. I'm not ready to hand my credentials to an AI agent to work on its own, but I've had good luck with anonymous AI chat bots when I need a quick PowerShell script or Excel macro."
1kqbe08,comment,mt4q7rf,1kqbe08,kerosene31,,2025-05-19 22:55:09,1,"How it would work if I ruled the world:

\-IT would be a strategic parter at the table with the same voice as other areas of the business.  IT should have a seat at the table from the start when decisions are made until implementation.  

How it will likely work:

\-Businesses will buy things without consulting IT at all, and leave it to the IT janitors to clean up the mess."
1kqbe08,comment,mt4t567,1kqbe08,ephemere_mi,,2025-05-19 23:09:51,1,"Company policies, by their nature, should be owned by HR, and enforced by the appropriate management.

That said, if you are asked to help write the policy, you should take that opportunity to make sure it doesn't end up being a bad one.  If you're still early in your career, it may also end up being a valuable experience and you'll likely get facetime with the people that will approve your next promotion."
1kqbe08,comment,mt4uon3,1kqbe08,zerinsakech1,,2025-05-19 23:17:34,1,"IT doesn't make the rules, we follow them."
1kqbe08,comment,mt4y5ql,1kqbe08,m0henjo,,2025-05-19 23:35:08,1,"Business leaders are being sold on the idea that they need AI.  So in essence it's a solution in search of a problem.

Can it help? Sure.  But if your organization is littered with ancient technology that can't easily be swapped out, AI isn't going to help.

As an IT professional, it's important to learn it and understand it."
1kqbe08,comment,mt51r5e,1kqbe08,MalwareDork,,2025-05-19 23:52:55,1,"Unless your confidentiality is ironclad, it's a general assumption IP is going to be leaked into chatGPT or the equivalent. The whole Tencent grift here on Reddit for Deepseek was a very comical circus show of the lack of concern people have for IP protection.

I'd just assume you're going to implement it in the future or shadow IT already has it churning its wheels. College students and professors already use chatGPT and its associates to a mind-numbing degree so it's a matter of when, not if. Have the proper policies and NDA's in place so legal can deal with inevitable leaks."
1kqbe08,comment,mt52o0f,1kqbe08,imnotabotareyou,,2025-05-19 23:57:21,1,It’s just another software to manage.
1kqbe08,comment,mt52thk,1kqbe08,SifferBTW,,2025-05-19 23:58:04,1,"I give input when asked, but I'm not drafting language. That's for the lawyers"
1kqbe08,comment,mt53h6a,1kqbe08,[deleted],,2025-05-20 00:01:23,1,"It’s both. The company decides what is and isn’t appropriate. IT use technology to enforce rules where and when they can.

I never understood these questions. Yes, the policy is for the business to make and for the employees to follow. That doesn’t mean we still don’t enforce. Oh your policy says you cannot install any unapproved software on your work machine. Do you give everyone local admin? I mean, they won’t install anything because of policy so.. 

That’s how I see these things as. If the business wants to blocked, it gets blocked."
1kqbe08,comment,mt540d2,1kqbe08,Timberwolf_88,InfoSec Engineer,2025-05-20 00:04:03,1,"The CIO/CISO needs to own the policy and governance, IT may need to own implementation and config to ensure compliance with policy.

If the company is/wants to be iso270001/nis2/cis/etc. compliant then ultimately the board witll have personal accountability."
1kqbe08,comment,mt55e44,1kqbe08,kagato87,,2025-05-20 00:10:58,1,"It informs management if risks that require considering.  For example customer data or pii needs to be kept out of public models.

Management creates the policy, IT tells them it's impossible to enforce from a purely technical standpoint and they need HR backing.

At least, that's usually how it goes..."
1kqbe08,comment,mt5el27,1kqbe08,ABotelho23,DevOps,2025-05-20 00:56:23,1,"I think it's silly to think IT shouldn't at least be consulting about AI.

Do you really want laypeople making these decisions?"
1kqbe08,comment,mt5f9br,1kqbe08,Carter-SysAdmin,,2025-05-20 00:59:36,1,"ISO 42001 is a new cert not many folks have locked in yet, I imagine it will become more and more relevant to more and more companies as things keep speeding up."
1kqbe08,comment,mt5i3ft,1kqbe08,dcsln,IT Manager,2025-05-20 01:13:18,1,"  
Do you want another department to manage AI in your organization? 

AI is like any other software/SaaS/product/etc. You can manage it, or someone else can manage it. The more tech tools are managed outside of IT, the less valuable IT is. Is that fair? No. Is that more work with no more compensation? Maybe. 

Broadly speaking, IT's role is to be smart about tech, and help the org make good technical decisions. Some of that involves managing tech directly, some of it involves being a trusted advisor. Both roles are really important. That's why all your vendors want to manage your systems and/or be your ""trusted advisor"". 

Give your advice. Recommend a program. Recommend training, project time, proofs-of-concept, and other stuff the IT team can do. Treat it like real work, that pushes out some other work. 

Whatever you do, don't sit on the sidelines."
1kqbe08,comment,mt5k4rd,1kqbe08,Apfaehler22,,2025-05-20 01:23:02,1,"We had training done for all our users. Especially in a healthcare environment it’s wild West with some of these guys. Very scary how security best practices are thrown out the window with the info they put in there. 

But who ever made the training video was not IT. Someone in upper management. It was trash and pretty sure half of the video was generated with AI. Using examples such as smart Alexa speakers and google assistant and calling them AI devices. 

I’ve been telling users who ask about it. To treat it like any other security measure we have while using the internet or checking emails and so on. And no your google assistant is not AI. 

It’s a wild time for sure."
1kqbe08,comment,mt5lh34,1kqbe08,povlhp,,2025-05-20 01:29:24,1,"A cloud service is a problem of whoever uses it and those who pays. 

IT pays for servers and services in the cloud here. So our AI is our problem. 

The other AI is a problem for legal."
1kqbe08,comment,mt5lsp6,1kqbe08,fresh-dork,,2025-05-20 01:30:55,1,"i work at a largish company that has an articulated AI policy:

* business set the policy (don't leak confidential info to external AI, bounds on how we use it internally, etc)
* IT and security implement controls to execute the policy and make exceptions from the norm when warranted.

i think the company is a but stuffy, but generally consistent in following good practices"
1kqbe08,comment,mt5pw93,1kqbe08,ARobertNotABob,,2025-05-20 01:50:20,1,"There are *very few* Directors fully conversant with the ramifications of embracing AI, which means it's going to be a case of the blind leading the blind most everywhere, with only bottom-lines truly scrutinised for effect, as increasingly usual."
1kqbe08,comment,mt5qbq1,1kqbe08,aintthatjustheway,,2025-05-20 01:52:22,1,"It's a business decision. My company blocks all public 'AI' resources.

I'm really happy about that."
1kqbe08,comment,mt5qs7w,1kqbe08,Xibbas,,2025-05-20 01:54:33,1,Its a legal/IT/Cybersecurity problem.
