post_id,type,id,parent_id,author,author_flair,created_time,ups,content
1kqbe08,comment,mt5sl7i,1kqbe08,Zenin,,2025-05-20 02:03:11,1,"TL;DR - Yes, it's *VERY* much an IT problem.

Our vendors have been pushing it on us with free credit bribes, etc...because as IT we're where their money comes from.  I've been pushing back hard on a few fronts:

1. We're IT, we don't build projects we support them.  Get us *training* and on how to best deploy and support the AI applications we're sure Business will be throwing at us.  We don't want to be the roadblock to progress, but we're probably not going to be the driver.
2. Hey you the vendor: If there are good use cases for IT to be using AI directly (not just deploying/supporting it), surely you've already got some idea of those from your other customers?  Please give us some high level (no NDA info) examples of how IT using AI directly is helpful.  And then explain how those use cases aren't already being covered by features of the IT apps we do use today such as within CrowdStrike, etc.
3. What specific guardrails can we put around these AI tools?  AWS for example is telling us that Q Developer in the Console/CLI will have ""the permissions of the user"".  As someone with pretty extensive permissions...that sounds absolutely horrible.  Our TAM is currently going to get back to me on what limit policy, if any, we can put around Q to satisfy this.  For example I *do* want Q to be able to see most all resource meta data, metrics, and logs, but absolutely *not* see data within buckets, dynamo tables, etc.
4. Additionally talk to me about your *business* AI tools in depth for two reasons: First, because like I noted in #1 we'll probably be asked to deploy and support them, but Secondly because as IT *we* can probably be customers for these ""Business"" tools.  For example, Amazon Q for Business can train against our Confluence docs, past issues in Jira, Slack discussions, email threads, etc and possibly combine those knowledge bases with our monitoring data, etc and be able to help IT trace down and connect the dots around new trouble tickets more efficiently and effectively.  BUT...like #3...that's going to need some very solid and clear guardrails because we certainly can't have user A seeing data that only user B should have access to simply because user A was clever with their prompts or whatever.
5. ROIs on *everything*.  AI is stupidly expensive.  What's the story around proving what the business spends on this actually returns meaningful value?  In revenue, in time to market, in systems reliability, etc.  Can we trace per-user metrics of AI to see if/how it's being adapted and/or what results it does or doesn't bring?"
1kqbe08,comment,mt5w39u,1kqbe08,ultraspacedad,,2025-05-20 02:20:11,1,It's 100% Management that decides what AI Controls are needed moving forward. If they are asking you because they don't know and pushing it on you then good. Just make sure company Data is Private and if the Boss doesn't know just use best practices and pray
1kqbe08,comment,mt61dm5,1kqbe08,DaemosDaen,IT Swiss Army Knife,2025-05-20 02:46:12,1,"My answer is going to be ""It depends""

Each org has a different set to regulation, guidelines and requirements concerning data. Your bosses may not know what those all are since they rely on IT to keep them on the up and up. (Or at least to let them know and they ignore. Make sure you document it.)

So it could easily be on the IT Department to make a suggestion that gets sent and Lawyered up before becoming Polify.

Example:

I work for several Police Departments, due to the unreliable nature and the fact that the data leaves our reasonable control, it is not acceptable for CJIS data to be opened to it. I advised my Director then we advised the County Admin (my Primary employer) of this and now we have a lawyered up version of ""No AI at this time."" One of the cities I work for has already made their own Policy. Once I advised of the CJIS information, they decided to have use separate the data."
1kqbe08,comment,mt63551,1kqbe08,loupgarou21,,2025-05-20 02:54:48,1,"In our organization it was somewhat easy because policies like that all come from HR, so our AI policy is coming out of the HR department.  That being said, HR worked with us in IT to help draft the policy."
1kqbe08,comment,mt658r7,1kqbe08,BarsoomianAmbassador,,2025-05-20 03:05:11,1,"The assumption would be that the IT department would have a better understanding of AI than the management team. It's tech, so it falls under the umbrella of the IT department to manage, ultimately. IT would help guide management in creating policies for AI use."
1kqbe08,comment,mt67ztp,1kqbe08,Complex86,,2025-05-20 03:19:03,1,It is a legal issue more than anything
1kqbe08,comment,mt685b7,1kqbe08,discosoc,,2025-05-20 03:19:49,1,"It's an HR and/or legal problem, same as watching porn or exfiltrating company data.  Sure, you can implement technical measures to curb it, but those measures need to be framed around what's established at a policy level.

Right now, however, nobody really knows what ""AI"" actually means for businesses because it's being tossed into fucking everything by everyone.  This is probably not going to chance until we finally see corporate lawsuits from AI fallout slugging it out in court, or Boeing going under after AI designed planes start crashing or something equally crazy.

Even then, I suspect it's not going to be ""banning AI"" so much as just trying to regulate how it's used -- especially in regard to client data.  I'm seeing this a little in insurance and HIPAA industries but it's kind of vague, like there's a known concern about protected or client data being ingested in an AI model, but nobody is really sure how to even outline the risk or verify such an infraction.  So it gets mentioned as prohibited with zero guidance on *how*."
1kqbe08,comment,mt69azx,1kqbe08,Redacted_Reason,,2025-05-20 03:25:38,1,Establish an SLA
1kqbe08,comment,mt6b90y,1kqbe08,MoeraBirds,,2025-05-20 03:35:26,1,"AI needs a joint governance approach: Privacy, Legal, IT, Security, Business. That lot agree the policy and governance model. 

Then IT operations people make it work within the guardrails. 

In a few years it’ll be core IT but right now it needs special attention."
1kqbe08,comment,mt6l7ne,1kqbe08,xgreenyflo,,2025-05-20 04:25:16,1,"no, it's a tool"
1kqbe08,comment,mt6lgyl,1kqbe08,telmo_gaspar,,2025-05-20 04:26:32,1,No! It's s tool.
1kqbe08,comment,mt7k1m8,1kqbe08,MateusKingston,,2025-05-20 07:34:34,1,"Shared as most people said, no one has all the info needed to do this alone"
1kqbe08,comment,mt7nxr6,1kqbe08,[deleted],,2025-05-20 07:57:22,1,It is when idiots think they can use AI to fix a problem and end up making it worse because AI is so confidently wrong so much of the time.
1kqbe08,comment,mt7wnfa,1kqbe08,ShowMeYourT_Ds,IT Manager,2025-05-20 08:50:47,1,"Starting place:

Free AI:
Don’t put anything in any AI you’d wouldn’t want in public. 

Paid AI:
Pay for an AI that won’t use your data to train."
1kqbe08,comment,mt7zwj6,1kqbe08,RobertBiddle,,2025-05-20 09:10:49,1,"From a corporate perspective, the concerns about AI usage fundamentally amount to data policy and management. 

That  &lt;i&gt;&lt;b&gt;is IT&lt;/i&gt;&lt;/b&gt;."
1kqbe08,comment,mt8180k,1kqbe08,mrcollin101,,2025-05-20 09:19:05,1,"It’s a technology, it’s IT’s role to document the risks and controls, then partner with the business units to determine what controls to put in place and what risks to accept.

Sysadmin determines the technologies capabilities for controls

Security Admin documents the risks

IT manager sets expectations for the above and determine priorities and timelines (maybe with a project manager in there if your org has one)

IT director partners with the business units to articulate and document the controls and accepted risks

CIO pulls rank when business units demand stupid shit

Then one the decisions are made it all flows in reverse to production"
1kqbe08,comment,mt8l8hl,1kqbe08,SwiftSpear,,2025-05-20 11:30:44,1,I assume IT manages things like accounts for third party services.  The vast majority of AI business use are variants of that system.  Very few businesses are running their own AI in AWS or something like that.
1kqbe08,comment,mt8vyxh,1kqbe08,NorthAntarcticSysadm,,2025-05-20 12:55:02,1,"It is a shared responsibility, not a problem


When used right it can enable roles and businesses to excel.


Most think it is solely an IT function to manage. Any policy or process which does not have backing of management, leadership, HR, etc, doesn't have any teeth. As IT you can guide the business leaders, HR and Legal to come up with policies for the business, but without a top-down approach it'll end up like your home lab. You know, the lab that is full of old equipment you don't have the time or energy to even power on."
1kqbe08,comment,mt9w20b,1kqbe08,dontmakemewait,,2025-05-20 18:49:46,1,"I don’t think any one department should be setting the rules. 

It’s a risk management problem. If your company is big enough, they will have a risk team. If it’s not, then someone still has the role of deciding what is your appetite for risk. That’s going to start defining your guard rails. Once they are in place tech teams need to figure out how to manage the tech side of the problem. It probably starts with education. Teach your staff about where the info
Comes from that builds Ls and make sure they are not adding IP or PII data into that mix."
1kqbe08,comment,mta4yxv,1kqbe08,Warm-Reporter8965,Sysadmin,2025-05-20 19:57:30,1,I work in healthcare so I'm unsure of AI within the industry due to the risk of HIPAA since you know some dingus is going to plug in client data looking for exact results.
1kqbe08,comment,mta8cdh,1kqbe08,Jacmac_,,2025-05-20 20:20:24,1,"Not an IT problem. Most organizations that are having panic attacks over AI are flailing around trying to stop it's usage, meanwhile Joe Employee is on his cell phone sending and recieving attachments and using AI left and right to get work done faster. The orgs worried about information leakage are straight up shouting at clouds."
1kqbe08,comment,mtall7j,1kqbe08,ryuut,,2025-05-20 21:41:01,1,It's cybers problem to define the guidance
1kqbe08,comment,mtbab9w,1kqbe08,lsudo,,2025-05-20 23:45:18,1,"The advent of AI in the school setting is no different from the impact of calculators in the classroom.  Our stance is that It's not going anywhere so faculty need to learn to work with not against.  We can block AI all day long but It's not going to do a damn thing.

The most important thing is for the school to establish what resposible AI utlilzation looks like with the students and faculty.  Secondly,  outfit faculty with the tools to evuate irresponsible AI utilization (When a student is letting AI do their thinking for them).  Thirdly is for the district to adopt firm policies for what happens when AI is abused.  At no point is IT involved aside from helping with the deployment of staff tools and resources."
1kqbe08,comment,mtgcsod,1kqbe08,Wulf621,,2025-05-21 19:14:29,1,"Monopolize. Offer to build an in-house AI, get some nice, fat GPUs. They make it your responsibility, you make it your power"
1kqbe08,comment,mtgjt6i,mtgcsod,Greenscreener,,2025-05-21 20:04:59,2,"First you get the GPU, then you get the women, then you get the power..."
1kqbe08,comment,mts88qz,1kqbe08,[deleted],,2025-05-23 12:55:16,1,It’s a people problem.
1kqbe08,comment,mu5nwfn,1kqbe08,Aerdi,,2025-05-25 19:47:41,1,"IT in collaboration with the CISO consults the C-Level Decisionmakers, usually CEO&amp;CFO on the risks and opportunities. I wouldn’t be comfortable with taking responsibility for a decision on such a regulatory pitfall."
1kqbe08,comment,muccetj,1kqbe08,Kungfubunnyrabbit,Sr. Sysadmin,2025-05-26 21:55:56,1,I feel that there should be a collaboration between the business and IT. If we leave the technology decisions to the business who knows what you will end up with.
1kqbe08,comment,neayk5c,1kqbe08,Clyph00,,2025-09-15 14:28:20,1,"AI is not an IT problem. The business owns policy with Legal and HR, security frames risk and control requirements, and IT implements. Start with a RACI, data classification, and a simple intake for AI use cases so approvals and exceptions are traceable. Tie it to ISO 42001 or your existing risk register.

What worked for us: business defined acceptable uses, security wrote control standards, IT enforced. We kept it lightweight and auditable. In the browser, we use LayerX to quietly keep prompts compliant while we sort out bigger governance pieces. Kept everyone productive and out of trouble."
